2214505,2025-02-01,1201-1800,AUO.Airport,AL,NA,4.3,50,NA,NA,VMC,10,NA,NA,CLR,NA,NA,Commercial Operator (UAS),Small UAS (At or above 0.55 lbs and less than 55 lbs),NA,1,Part 107,None,NA,NA,Cruise,NA,Class D AUO,NA,NA,NA,NA,NA,NA,NA,NA,NA,NA,NA,FALSE,NA,NA,Small,Multi-Rotor,NA,NA,NA,Airport / Aerodrome / Heliport,NA,Purchased,Number of UAS 1,NA,NA,NA,NA,NA,NA,NA,NA,NA,NA,NA,NA,NA,NA,NA,NA,NA,NA,NA,NA,NA,NA,NA,NA,NA,NA,NA,NA,NA,NA,NA,NA,NA,NA,NA,NA,NA,NA,NA,Outdoor / Field Station (UAS),NA,Commercial Operator (UAS),Person Manipulating Controls (UAS); Remote PIC (UAS),Flight Crew Private; Flight Crew Remote Pilot (UAS); Flight Crew Instrument,NA,NA,Situational Awareness,NA,NA,2214505,NA,NA,NA,NA,NA,NA,NA,NA,NA,NA,NA,Airspace Violation All Types; Deviation / Discrepancy - Procedural Published Material / Policy; Deviation / Discrepancy - Procedural Unauthorized Flight Operations (UAS); Deviation / Discrepancy - Procedural FAR,NA,NA,Person UAS Crew,Other Post-flight,General None Reported / Taken,Chart Or Publication; Human Factors; Software and Automation; Airspace Structure,Ambiguous,I was unaware that the AUO airport class D expanded into my operation; as before it was only a class E. I thought I was clear to fly in the area but upon my post flight I realized I had accidentally entered the new class D. Typically my drone alerts me when I near controlled airspace; but on this occasion the drone software did not alert me of the impending incursion to the recently added class D airspace.,NA,NA,NA,Part 107 UAS pilot reported flying in controlled airspace without authorization when the software did not alert the pilot that the airspace was nearby.
2214670,2025-02-01,1201-1800,ZZZ.Airport,US,NA,NA,NA,NA,NA,NA,NA,NA,NA,NA,NA,TRACON ZZZ,Air Carrier,Regional Jet 900 (CRJ900),NA,2,Part 121,IFR,Passenger,NA,Final Approach,NA,Class B ZZZ,NA,NA,NA,NA,NA,NA,NA,NA,NA,NA,NA,NA,NA,NA,NA,NA,NA,NA,NA,NA,NA,NA,NA,NA,NA,NA,NA,NA,NA,UAV: Unpiloted Aerial Vehicle,NA,1,NA,NA,NA,NA,NA,NA,Class B ZZZ,NA,NA,NA,NA,NA,NA,NA,NA,NA,NA,NA,NA,NA,NA,NA,NA,NA,NA,NA,Airport / Aerodrome / Heliport; Aircraft / UAS,NA,NA,NA,Aircraft X,Flight Deck,Air Carrier,First Officer; Pilot Not Flying,Flight Crew Air Transport Pilot (ATP); Flight Crew Instrument; Flight Crew Multiengine,Flight Crew Type 1100,NA,Situational Awareness,NA,NA,2214670,Aircraft X,Flight Deck,Air Carrier,Captain; Pilot Flying,Flight Crew Instrument; Flight Crew Multiengine; Flight Crew Air Transport Pilot (ATP),Flight Crew Type 1200,NA,NA,NA,NA,2216617,Airspace Violation All Types; Conflict NMAC; Deviation / Discrepancy - Procedural Published Material / Policy; Deviation / Discrepancy - Procedural Unauthorized Flight Operations (UAS); Deviation / Discrepancy - Procedural FAR,NA,NA,Person Flight Crew,In-flight,Air Traffic Control Provided Assistance; Flight Crew Requested ATC Assistance / Clarification,Human Factors,Human Factors,We were flying into ZZZ I was pilot monitoring. The Captain was pilot flying. Over the Captain's left shoulder next to the left wing the Captain claimed that he saw a drone. However I was unable to actually get a visual on the object to see what it was. However I did see a shadow in my peripheral vision. He had claimed that it was a drone and told me let ATC know. [I was] pilot monitoring; and I was communicating on the radios. I believe at this time we had been flying on the arrival or a possible vector onto the final approach course for the runway. I replied with his request a notified ATC of what the Captain thought he saw. About 2 minutes after that PIREP ATC respond with a couple questions about the object he saw. I had not seen the object so I was communicating with the Captain as ATC was asking the questions. A few examples of the questions are: Was it a quadcopter? Was it a rotor craft a fixed wing-craft? What size would you say it was? I would look over to him and he would respond the best that he could describe what he had saw. After all the reporting I had made to ATC he then looked over and said you know maybe it was the kids balloon or something. I wish I could contribute more details however I personally did not see the object. I can account for a slight blur or shadow in my peripheral vision.,NA,Drone Near MissCause: Drone or similar object unreported in controlled airspace. Object passed near left side of aircraft.  Within the wingspan.,NA,Air carrier flight crew reported an NMAC on final approach with a UAS. No evasive action was taken.
2215463,2025-02-01,1201-1800,PDX.Airport,OR,NA,NA,600,NA,NA,NA,NA,NA,NA,NA,NA,NA,Air Carrier,Medium Large Transport; Low Wing; 2 Turbojet Eng,NA,2,Part 121,IFR,Passenger,NA,Final Approach,NA,Class C PDX,NA,NA,NA,NA,NA,NA,NA,NA,NA,NA,NA,NA,NA,NA,NA,NA,NA,NA,NA,NA,NA,NA,NA,NA,NA,NA,NA,NA,NA,UAV: Unpiloted Aerial Vehicle,NA,1,NA,NA,NA,NA,NA,NA,Class C PDX,NA,NA,NA,NA,NA,NA,NA,NA,NA,NA,NA,NA,NA,NA,NA,NA,NA,NA,NA,Airport / Aerodrome / Heliport; Aircraft / UAS,NA,NA,NA,Aircraft X,Flight Deck,Air Carrier,Pilot Flying; Captain,Flight Crew Air Transport Pilot (ATP); Flight Crew Multiengine; Flight Crew Instrument,NA,NA,NA,NA,NA,2215463,NA,NA,NA,NA,NA,NA,NA,NA,NA,NA,NA,Airspace Violation All Types; Conflict Airborne Conflict; Deviation / Discrepancy - Procedural Published Material / Policy; Deviation / Discrepancy - Procedural Unauthorized Flight Operations (UAS); Deviation / Discrepancy - Procedural FAR,NA,NA,Person Flight Crew,In-flight,General None Reported / Taken,Human Factors,Human Factors,While on final approach for the ILS 10R into PDX and between the points of JADNU and the beginning of the runway threshold as we were passing over the INTERSTATE I-5 Bridge over the Colombia River I saw the drone flying underneath the aircraft off to my left side. The only reason I had looked out off to the left is because an aircraft was taking off from the local Pearson VUO airport on the other side of the river and when I was looking that way is when I noticed the drone flying underneath us by the bridge. It was heading west up the river and towards downtown Portland. No disruption nor damage to the aircraft occurred. Suggestions: There shouldn't be even any drone activity around a major airport like that especially when aircraft are landing in the vicinity of where the drone was flying.,NA,NA,NA,Air carrier Captain reported an airborne conflict on final approach with a UAS. No evasive action was taken.
2215494,2025-02-01,0601-1200,FIRMN,TX,NA,13,NA,15500,NA,NA,NA,NA,NA,NA,NA,TRACON D10,Air Carrier,Medium Large Transport; Low Wing; 2 Turbojet Eng,NA,2,Part 121,IFR,Passenger,NA,Climb,SID HRPER3,Class E D10,NA,NA,NA,NA,NA,NA,NA,NA,NA,NA,NA,NA,NA,NA,NA,NA,NA,NA,NA,NA,NA,NA,NA,NA,NA,NA,NA,NA,NA,UAV: Unpiloted Aerial Vehicle,NA,1,NA,NA,NA,NA,NA,NA,Class E D10,NA,NA,NA,NA,NA,NA,NA,NA,NA,NA,NA,NA,NA,NA,NA,NA,NA,NA,NA,Aircraft / UAS,NA,NA,NA,Aircraft X,Flight Deck,Air Carrier,Captain; Pilot Flying,Flight Crew Multiengine; Flight Crew Air Transport Pilot (ATP); Flight Crew Instrument,NA,NA,NA,NA,NA,2215494,NA,NA,NA,NA,NA,NA,NA,NA,NA,NA,NA,Airspace Violation All Types; Conflict NMAC; Deviation / Discrepancy - Procedural Unauthorized Flight Operations (UAS); Deviation / Discrepancy - Procedural FAR; Deviation / Discrepancy - Procedural Published Material / Policy,Vertical 100,NA,Person Flight Crew,In-flight,General None Reported / Taken,Human Factors,Human Factors,Climbing through 15;500 feet on the HRPER3 departure off 18L Just as I looked up from my instruments and out the window I saw what appeared to be a drone pass about 100 feet above the cockpit. It happened very fast and the only features I was able to identify was that it was longer than it was wide; the color was white; and I saw something black which may have been rotors. It appeared to be not a small hobby drone and it looked maybe 3 to 4 feet long. The First Officer did not see the drone. This event probably lasted about a second. Considering the altitude I believe the sighting took place about 13nm past FIRMN waypoint.I understand this may not be a very detailed report and my description may lack some accuracy; however; I may not be the only pilot to report a drone in that area or there may be others in the future. At least this generates a history.,NA,NA,NA,Air carrier Captain reported an NMAC with a UAS while on climbout. No evasive action was taken.
2215684,2025-02-01,1201-1800,CHD.Airport,AZ,320,0.5,NA,2300,NA,VMC,10,NA,Daylight,NA,NA,NA,FBO,Small Aircraft; High Wing; 1 Eng; Fixed Gear,NA,2,Part 91,NA,Training,NA,Initial Approach,Visual Approach,Class D CHD,NA,NA,NA,NA,NA,NA,NA,NA,NA,NA,NA,NA,NA,NA,NA,NA,NA,NA,NA,NA,NA,NA,NA,NA,NA,NA,NA,NA,NA,UAV: Unpiloted Aerial Vehicle,NA,1,NA,NA,NA,NA,NA,NA,Class D CHD,NA,NA,NA,NA,NA,NA,NA,NA,NA,NA,NA,NA,NA,NA,NA,NA,NA,NA,NA,Airport / Aerodrome / Heliport; Aircraft / UAS,NA,NA,NA,Aircraft X,NA,FBO,Instructor,Flight Crew Flight Instructor; Flight Crew Instrument; Flight Crew Commercial,Flight Crew Last 90 Days 57; Flight Crew Total 962; Flight Crew Type 443,NA,NA,NA,NA,2215684,NA,NA,NA,NA,NA,NA,NA,NA,NA,NA,NA,Airspace Violation All Types; Conflict NMAC; Deviation / Discrepancy - Procedural Unauthorized Flight Operations (UAS); Deviation / Discrepancy - Procedural FAR; Deviation / Discrepancy - Procedural Published Material / Policy,Horizontal 25; Vertical 0,NA,Person Flight Crew,In-flight,General None Reported / Taken,Human Factors,Human Factors,Small aircraft training flight in CHD right pattern for 22R. Midfield in the downwind a drone was spotted at 2300 feet pattern altitude on the right side of the aircraft. Was a mid sized drone with a green light and was not showing up on ADSB. No evasive maneuvers were needed to avoid and was not seen after incident. No damage to aircraft and landing was made no issues.,NA,NA,NA,Flight Instructor reported an NMAC with a UAS while in the traffic pattern. No evasive action was taken and the flight continued without further incident.
2216156,2025-02-01,NA,ZZZ.Airport,US,NA,NA,NA,1000,NA,VMC,NA,NA,NA,NA,NA,Tower ZZZ,Air Carrier,B737 Undifferentiated or Other Model,NA,2,Part 121,IFR,Passenger,NA,Final Approach,NA,Class B ZZZ,NA,NA,NA,NA,NA,NA,NA,NA,NA,NA,NA,NA,NA,NA,NA,NA,NA,NA,NA,NA,NA,NA,NA,NA,NA,NA,NA,NA,NA,UAV: Unpiloted Aerial Vehicle,NA,1,NA,NA,NA,NA,NA,NA,Class B ZZZ,NA,NA,NA,NA,NA,NA,NA,NA,NA,NA,NA,NA,NA,NA,NA,NA,NA,NA,NA,Airport / Aerodrome / Heliport; Aircraft / UAS,NA,NA,NA,Aircraft X,Flight Deck,Air Carrier,Check Pilot; Pilot Not Flying; Captain,Flight Crew Air Transport Pilot (ATP); Flight Crew Instrument; Flight Crew Multiengine,Flight Crew Last 90 Days 192.22; Flight Crew Total 3341.90; Flight Crew Type 2401.98,NA,NA,NA,NA,2216156,Aircraft X,Flight Deck,Air Carrier,Captain; Pilot Flying,Flight Crew Multiengine; Flight Crew Instrument; Flight Crew Air Transport Pilot (ATP),Flight Crew Last 90 Days 18.28; Flight Crew Type 621.85,NA,NA,NA,NA,2216172,Airspace Violation All Types; Conflict NMAC; Deviation / Discrepancy - Procedural Unauthorized Flight Operations (UAS); Deviation / Discrepancy - Procedural Published Material / Policy; Deviation / Discrepancy - Procedural FAR,Horizontal 0; Vertical 200,NA,Person Flight Crew,In-flight,General None Reported / Taken,Human Factors,Human Factors,I reported to tower that some balloons or possible drone just flew right over us at about 1200'. It was quick; but if I remember correctly; it was 2 or 3 balloons and attached to the bottom was a black square looking box.  When the sun reflected off of it; it had a tint of blue.   They asked for a description; but we were coming up to 500' and told them I will tell them on the ground.  However; tower notified the Commercial Aircraft I believe who was behind us.  They reported seeing these Mylar ballon's at 1200' on the extended runway centerline.  Since they gave the description; I did not bother to relay the information.,NA,On approach to RWY XXR. (ZZZ visual); crew noticed what appeared to be balloons or drone on final approach. It was not in the flight path of the aircraft but PM notified tower. Altitude was around 1000-1500'; roughly 2-3 miles from approach end of RWY. (Drone was above aircraft altitude and south).  Landed uneventfully.  Subsequent aircraft also were visual with traffic.,NA,Air carrier flight crew reported an NMAC on final approach with what was possibly a UAS or balloon. No evasive action was taken.
2216450,2025-02-01,1801-2400,ZZZ.Airport,US,NA,10,1200,NA,NA,NA,10,NA,Night,CLR,NA,NA,Air Taxi,Helicopter,NA,3,Part 135,NA,Ambulance,NA,Cruise,NA,NA,NA,NA,NA,NA,NA,NA,NA,NA,NA,NA,NA,NA,NA,NA,NA,NA,NA,NA,NA,NA,NA,NA,NA,NA,NA,NA,NA,NA,NA,UAV: Unpiloted Aerial Vehicle,NA,1,NA,NA,NA,NA,NA,NA,NA,NA,NA,NA,NA,NA,NA,NA,NA,NA,NA,NA,NA,NA,NA,NA,NA,NA,NA,NA,Aircraft / UAS,NA,NA,NA,NA,NA,Air Taxi,Observer,NA,NA,NA,NA,NA,NA,2216450,NA,NA,NA,NA,NA,NA,NA,NA,NA,NA,NA,Airspace Violation All Types; Conflict NMAC; Deviation / Discrepancy - Procedural Unauthorized Flight Operations (UAS); Deviation / Discrepancy - Procedural Published Material / Policy; Deviation / Discrepancy - Procedural FAR,Horizontal 5; Vertical 5,NA,Person Flight Crew,In-flight,Flight Crew Took Evasive Action,Human Factors; Environment - Non Weather Related,Ambiguous,I represent a part 135 Air Ambulance Operator. On Day 0 @ approx XA30 hours one of our helicopters was involved in a near miss with an Unidentified Flying Object; believed to be a drone; at approx 7200'MSL; or 1200' AGL over the nearby region (10 miles SE of ZZZ). The Pilot and Medical Crew were flying under Night Vision Goggles (NVGs) on departure from the ZZZ area; returning to ZZZ1. One of the crew saw an object directly in front of the windscreen and called to the pilot to take evasive action. The pilot banked hard to the left; and another crewmember witnessed the object pass to the right of the fuselage and just below the main rotor disc. It was estimated that the object was less than 10' from the aircraft.The crew believed the object to be a drone; but was unable to positively identify it due to the night time conditions.,The reporter stated it is uncertain whether the object was a drone or balloon. Reporter also stated this is the first time an NMAC with an unknown object has happened to any of the company helicopter crews but they have had drone sightings previously.,NA,NA,Air ambulance employee reported an NMAC between one of the company's helicopters and a supposed UAS or balloon during a flight. The helicopter crew took evasive action to avoid a collision.
2217701,2025-02-01,1201-1800,ZZZ.Airport,US,NA,NA,231,NA,NA,VMC,10,NA,Daylight,CLR,NA,NA,Government,Small UAS (At or above 0.55 lbs and less than 55 lbs),NA,2,Part 107,None,Search & Rescue,NA,Takeoff / Launch,NA,Class D ZZZ,NA,NA,NA,NA,NA,NA,NA,NA,NA,NA,NA,FALSE,NA,NA,Small,Multi-Rotor,VLOS,TRUE,Manual Control,Airport / Aerodrome / Heliport; Critical Infrastructure,NA,Purchased,Number of UAS 1,NA,NA,NA,NA,NA,NA,NA,NA,NA,NA,NA,NA,NA,NA,NA,NA,NA,NA,NA,NA,NA,NA,NA,NA,NA,NA,NA,NA,NA,NA,NA,NA,NA,NA,NA,NA,NA,NA,NA,Outdoor / Field Station (UAS),NA,Government,Remote PIC (UAS); Person Manipulating Controls (UAS),Flight Crew Remote Pilot (UAS),Flight Crew Total 7.04; Flight Crew Total (UAS) 11.25,NA,Time Pressure,NA,NA,2217701,NA,NA,NA,NA,NA,NA,NA,NA,NA,NA,NA,Airspace Violation All Types; Deviation / Discrepancy - Procedural Unauthorized Flight Operations (UAS); Deviation / Discrepancy - Procedural Published Material / Policy; Deviation / Discrepancy - Procedural FAR,NA,NA,Person UAS Crew,Other Post-flight,General None Reported / Taken,Human Factors; Procedure,Ambiguous,On Day 0; I responded to the scene to attempt to locate endangered missing child. This location is X.X nautical miles south of ZZZ airport. The child was in an area where heavy vehicle traffic was present and a major road was nearby. Due to the exigent circumstance I responded to the scene lights/sirens to conduct a search and resecure mission with a drone to locate the child. After the child was found; the conclusion of the mission; I discovered no contact was made to FAA for approval in the airspace.,NA,NA,NA,Government UAS crew reported flying in controlled airspace without authorization.
2218117,2025-03-01,1801-2400,ZZZ.Airport,US,NA,4.45,188,NA,NA,VMC,10,NA,Night,CLR,NA,NA,Commercial Operator (UAS),DJI M30T,NA,1,Part 107,None,Surveying / Mapping (UAS),NA,Cruise,NA,Class G ZZZ,NA,NA,NA,NA,NA,NA,NA,NA,NA,NA,NA,FALSE,NA,NA,Small,Multi-Rotor,VLOS,FALSE,Autonomous / Fully Automated,Private Property,NA,Purchased,Number of UAS 1,NA,NA,NA,NA,NA,NA,Helicopter,NA,NA,NA,NA,NA,NA,Cruise,NA,NA,NA,NA,NA,NA,NA,NA,NA,NA,NA,NA,NA,NA,NA,NA,NA,NA,NA,NA,NA,NA,NA,NA,NA,Outdoor / Field Station (UAS),NA,Commercial Operator (UAS),Remote PIC (UAS); Person Manipulating Controls (UAS),Flight Crew Multiengine; Flight Crew Instrument; Flight Crew Commercial; Flight Crew Remote Pilot (UAS),Flight Crew Last 90 Days (UAS) 3.6; Flight Crew Total 2875; Flight Crew Total (UAS) 405; Flight Crew Type (UAS) 5.98,NA,Time Pressure; Situational Awareness,NA,NA,2218117,NA,NA,NA,NA,NA,NA,NA,NA,NA,NA,NA,Conflict NMAC,Horizontal 200; Vertical 100,NA,Person UAS Crew,In-flight,General None Reported / Taken,Human Factors; Environment - Non Weather Related; Procedure,Ambiguous,On Day 0; I conducted two autonomous flights to capture imagery of a hotel located in Class G airspace. Two flights were planned; the first approximately 2 hours before sunset (XA:33 Hours); utilizing a DJI Mavic 3 Enterprise. An autonomous flight plan was created; capturing RGB images along parallel flight lines oriented 258/78 degrees with a 90% overlap directly over the hotel property at approximately 165' AGL altitude. Upon completion of the autonomous portion of the flight; oblique images were captured by manual flight around the property's perimeter. The UAS captured images with the camera angled at 45 degrees and oriented towards the building throughout the flight while manually flying around the entire perimeter at 5-7 MPH. Upon completing the perimeter flight/oblique image capture; the UAS pilot decided to execute a second autonomous flight; adjusting the UAS speed to 9 MPH vs 15 MPH of the first autonomous flight. All three of these flights (autonomous flights 1 & 2; plus 1 perimeter oblique flight) were conducted without incident and concluded approximately 1.5 hours before sunset.  The second half of the mission was flown with a DJI M30T; a UAS with a thermal sensor to capture IR images of the hotel's roof. This flight could not begin until 30 minutes after sunset (XB:03). While waiting for the flight window to open; I heard a helicopter close by and noticed it approximately 1/4 SM East; likely landing at the medical center approaching from the south. Coincidentally; I took a photo of the helicopter at XA:48; just before it disappeared behind the buildings. As soon as the thermal window opened; the M30T was launched and commenced its autonomous flight. The UAS was operating at 188' AGL; and the flight was expected to be completed in 7 minutes.  The flight path maintained the orientation of 78/258 degrees and a 90% overlap. About midway through the flight; the helicopter was heard; but it did not sound like it was taking off; or if it was; it was hovering for a period of time. The helicopter suddenly appeared; the drone was on a 78-degree leg and directly over the hotel. The helicopter was on a westerly flight path at a very low altitude and high rate of speed. I noticed dual landing lights on the helicopter's nose were illuminated; which assisted in assessing the altitude and direction of flight. The instant I determined the helicopter's flight direction could conflict with my UAS operation; I anticipated terminating the flight and taking evasive action. The UAS anti-collision beacons (strobes; upper and lower) had been activated before launch; and the helicopter pilot likely saw them. While they did not appear to take evasive action; the helicopter passed just south of our operation; parallel to the UAS's autonomous flight path. The altitude at which the helicopter pilot departed the area was too low. As a manned pilot with several hours of helicopter flight instruction; I understand helicopters operate at much lower altitudes than fixed-wing aircraft.  Remember that the UAS was operating at 188' AGL - but only 90-95' above the hotel's roof.  As a pilot since 19XX; with ASEL/AMEL ratings; and a CFII for 30+ years; this is the first time I've filed a report; and the first time in nearly 3;000 hours of flight time it felt necessary; not because this is sometimes viewed as a way to cover yourself. I'm not concerned about the compliance of the UAS flight - but more concerned that the helicopter flight could have put themselves or someone on the ground in danger if their flight path had been a few degrees to the right.,NA,NA,NA,Part 107 UAS pilot reported a near miss with a low flying helicopter operating at a nearby medical center. Neither pilot took evasive action.
